pr_number;created_at;merged_at;time_to_merge_hours;changed_files;lines_changed;total_comments;total_reviews;pr_title;pr_body;has_changes_requested;main_module;cross_modules;labels_list;inferred_task_type;commit_messages
136445;2026-01-23T02:13:55Z;2026-01-23T03:55:26Z;1,69;2;6;6;2;Fix volume/nfs image for CentOS Stream 9;"The volume/nfs:1.5 image was updated from CentOS 8 to CentOS Stream 9 in commit 9b47a09, but this broke NFS server startup because NFSv2 is no longer supported in RHEL 9 / CentOS Stream 9.The -N 2 flag (disable NFSv2) passed to rpc.mountd and rpc.nfsd causes them to fail with ""2: Unsupported version"" since there's no NFSv2 to disable. This prevented rpc.nfsd from starting, causing NFS mount timeouts in e2e tests.Fix by removing the -N 2 flags. NFSv2 is already unavailable in CentOS Stream 9, so explicitly disabling it is unnecessary.Red Hat documentation states: ""NFS version 2 (NFSv2) is no longer supported by Red Hat.""Reference: https://access.redhat.com/documentation/en-us/red_hat_enterprise_linux/9/html/managing_file_systems/mounting-nfs-shares_managing-file-systemsWhat type of PR is this?/kind cleanupWhat this PR does / why we need it:Which issue(s) this PR is related to:Special notes for your reviewer:Does this PR introduce a user-facing change?NONEAdditional documentation e.g., KEPs (Kubernetes Enhancement Proposals), usage docs, etc.:";TRUE;test;test;area/test, kind/cleanup, lgtm, size/XS, release-note-none, approved, cncf-cla: yes, sig/testing, needs-priority, needs-triage;bugfix;"Fix volume/nfs image for CentOS Stream 9  The volume/nfs:1.5 image was updated from CentOS 8 to CentOS Stream 9 in commit 9b47a096f4b, but this broke NFS server startup because NFSv2 is no longer supported in RHEL 9 / CentOS Stream 9.  The `-N 2` flag (disable NFSv2) passed to rpc.mountd and rpc.nfsd causes them to fail with ""2: Unsupported version"" since there's no NFSv2 to disable. This prevented rpc.nfsd from starting, causing NFS mount timeouts in e2e tests.  Fix by removing the `-N 2` flags. NFSv2 is already unavailable in CentOS Stream 9, so explicitly disabling it is unnecessary.  Red Hat documentation states: ""NFS version 2 (NFSv2) is no longer supported by Red Hat.""  Reference: https://access.redhat.com/documentation/en-us/red_hat_enterprise_linux/9/html/managing_file_systems/mounting-nfs-shares_managing-file-systems  Signed-off-by: Davanum Srinivas <davanum@gmail.com>"
136122;2026-01-09T03:24:30Z;2026-01-12T21:25:01Z;90,01;2;8;10;1;Automated cherry pick of #135631: Switch ipvs and winkernel back to more regular forced syncs;"Cherry pick of #135631 on release-1.35.#135631: Switch ipvs and winkernel back to more regular forced syncsFor details on the cherry pick process, see the cherry pick requests page.Fixes a 1.34+ regression in ipvs and winkernel kube-proxy backends; these are now reverted back to theirpre-1.34 behavior of regularly rechecking all of their rules even when noServices or EndpointSlices change.";FALSE;pkg;pkg;kind/bug, priority/important-soon, sig/network, area/kube-proxy, lgtm, release-note, size/XS, cherry-pick-approved, approved, sig/windows;other;Switch ipvs and winkernel back to more regular forced syncs
136429;2026-01-22T15:51:21Z;2026-01-22T21:33:35Z;5,70;3;8;5;1;Remove ppc64le and s390x support from npb-is image;The npb-is image was failing to build on ppc64le with relocation overflow:relocation truncated to fit: R_PPC64_TOC16_HA against symbol 'key_array'Remove ppc64le and s390x from supported architectures:The IS benchmark with CLASS=D has ~8GB data arrays that require special compiler flags for non-x86 architecturesppc64le and s390x builds are difficult to test and maintainKeep amd64 and arm64 which are the primary node performance test targetsI don't think these arch(es) ever worked!What type of PR is this?/kind cleanupWhat this PR does / why we need it:Which issue(s) this PR is related to:Special notes for your reviewer:Does this PR introduce a user-facing change?NONEAdditional documentation e.g., KEPs (Kubernetes Enhancement Proposals), usage docs, etc.:;FALSE;test;test;area/test, kind/cleanup, lgtm, sig/node, size/XS, release-note-none, approved, cncf-cla: yes, sig/testing, needs-priority;feature;Remove ppc64le and s390x support from npb-is image  The npb-is image was failing to build on ppc64le with relocation overflow:   relocation truncated to fit: R_PPC64_TOC16_HA against symbol 'key_array'  Remove ppc64le and s390x from supported architectures: - The IS benchmark with CLASS=D has ~8GB data arrays that require special   compiler flags for non-x86 architectures - ppc64le and s390x builds are difficult to test and maintain - Keep amd64 and arm64 which are the primary node performance test targets  I don't think these arch(es) ever worked!  Signed-off-by: Davanum Srinivas <davanum@gmail.com>
135940;2025-12-26T10:12:22Z;2026-01-22T21:33:28Z;659,35;2;290;13;30;webhook admission: avoid risk of flakes;What type of PR is this?/kind bug/kind failing-test/kind flakeWhat this PR does / why we need it:The unit test flaked at least once so far in the CI. Cannot be reproduced locally, though.=== RUN   TestGetMutatingWebhookConfigSmartReload/create_configuration_and_update_moar_of_them    mutating_webhook_manager_test.go:238: Expected number of webhooks 4 received 0    mutating_webhook_manager_test.go:245: Expected number of creations 4 received 0    mutating_webhook_manager_test.go:266: Expected final number of webhooks 5 received 3--- FAIL: TestGetMutatingWebhookConfigSmartReload/create_configuration_and_update_moar_of_them (2.00s)There were two potential root causes:The watch must be set up completely before creating objects (a fake client-go limitation, #135959 tries to address it).The delay might be too small on a loaded system.By running the tests in a synctest bubble with synctest.Wait calls at the right places both problems are avoided. As a welcome side effect the test also completes faster.Before:ok  	k8s.io/apiserver/pkg/admission/configuration	21.036sAfter:ok  	k8s.io/apiserver/pkg/admission/configuration	12.534s2m0s: 2274 runs so far, 0 failures, 256 activeWhich issue(s) this PR is related to:N/ASpecial notes for your reviewer:Flake is from https://prow.k8s.io/view/gs/kubernetes-ci-logs/pr-logs/pull/135395/pull-kubernetes-unit/2003404146677387264Does this PR introduce a user-facing change?NONE/cc @liggitt @jpbetz;FALSE;staging;staging;kind/bug, area/apiserver, lgtm, sig/api-machinery, size/L, kind/flake, release-note-none, approved, cncf-cla: yes, kind/failing-test;other;webhook admission: avoid risk of flakes  The unit test flaked at least once so far in the CI. Cannot be reproduced locally, though.      === RUN   TestGetMutatingWebhookConfigSmartReload/create_configuration_and_update_moar_of_them         mutating_webhook_manager_test.go:238: Expected number of webhooks 4 received 0         mutating_webhook_manager_test.go:245: Expected number of creations 4 received 0         mutating_webhook_manager_test.go:266: Expected final number of webhooks 5 received 3     --- FAIL: TestGetMutatingWebhookConfigSmartReload/create_configuration_and_update_moar_of_them (2.00s)  There were two potential root causes: - The watch must be set up completely before creating objects (a fake   client-go limitation, fix separately). - The delay might be too small on a loaded system.  By running the tests in a synctest bubble with synctest.Wait calls at the right places both problems are avoided. As a welcome side effect the test also completes faster.  Before:      ok  	k8s.io/apiserver/pkg/admission/configuration	21.036s  After:      ok  	k8s.io/apiserver/pkg/admission/configuration	4.029s      2m0s: 13801 runs so far, 0 failures
136258;2026-01-15T19:30:50Z;2026-01-22T01:49:27Z;150,31;3;6;8;1;update core binaries to go 1.25.6 for CVE fixes;What type of PR is this?/kind featureWhat this PR does / why we need it:Upgrades go to 1.25.6 to address vulns:https://groups.google.com/d/msgid/golang-announce/5ee6bc63.BAAACBhEM_oAAAAAAAAAA-p9MGAAAYKKSQYAAAAAADE8OwBpaTkp%40mailjet.com?utm_medium=email&utm_source=footerWhich issue(s) this PR is related to:Special notes for your reviewer:Does this PR introduce a user-facing change?Kubernetes is now built with Go 1.25.6Additional documentation e.g., KEPs (Kubernetes Enhancement Proposals), usage docs, etc.:/sig releasemanual cherry-pick of #136257;FALSE;root;build, root, staging;lgtm, release-note, size/XS, kind/feature, area/release-eng, cherry-pick-approved, approved, cncf-cla: yes, sig/release, needs-priority;bugfix;bump go to 1.25.6 for CVE fixes
136123;2026-01-09T03:24:57Z;2026-01-10T01:43:39Z;22,31;2;8;5;1;Automated cherry pick of #135631: Switch ipvs and winkernel back to more regular forced syncs;"Cherry pick of #135631 on release-1.34.#135631: Switch ipvs and winkernel back to more regular forced syncsFor details on the cherry pick process, see the cherry pick requests page.Fixes a 1.34+ regression in ipvs and winkernel kube-proxy backends; these are now reverted back to theirpre-1.34 behavior of regularly rechecking all of their rules even when noServices or EndpointSlices change.";FALSE;pkg;pkg;kind/bug, priority/important-soon, sig/network, area/kube-proxy, lgtm, release-note, size/XS, cherry-pick-approved, approved, sig/windows;other;Switch ipvs and winkernel back to more regular forced syncs
135631;2025-12-05T17:02:20Z;2026-01-08T20:41:47Z;819,66;2;8;7;2;Switch ipvs and winkernel back to more regular forced syncs;"What this PR does / why we need it:In the BoundedFrequencyRunner rewrite (#131615) we changed the ""resync even if nothing changed"" period for ipvs and winkernel from 30s (configurable) to 1h (hardcoded). (It was already 1h for iptables and nftables.) This just flips it back.In most cases the extra resyncs are unnecessary and wasteful, but maybe some people have use cases where they need them, so let's not change the behavior right before deprecating IPVS.(@princepereira The same change happened for winkernel and I'm reverting that back to the 1.33 behavior now too.)Which issue(s) this PR is related to:Fixes #134147Does this PR introduce a user-facing change?Fixes a 1.34+ regression in ipvs and winkernel kube-proxy backends; these are now reverted back to theirpre-1.34 behavior of regularly rechecking all of their rules even when noServices or EndpointSlices change./kind bug/kind regression/sig network/sig windows/area kube-proxy/area ipvs/priority important-soon";FALSE;pkg;pkg;kind/bug, priority/important-soon, sig/network, area/kube-proxy, lgtm, release-note, size/XS, approved, sig/windows, cncf-cla: yes;other;Switch ipvs and winkernel back to more regular forced syncs
136407;2026-01-21T19:46:30Z;2026-01-22T20:39:35Z;24,88;26;316;10;0;Bump etcd client SDK to 3.6.7;What type of PR is this?/kind cleanupWhat this PR does / why we need it:Bumps the etcd client SDK to 3.6.7Which issue(s) this PR is related to:etcd-io/etcd#21015Special notes for your reviewer:Does this PR introduce a user-facing change?Updates the etcd client library to v3.6.7Additional documentation e.g., KEPs (Kubernetes Enhancement Proposals), usage docs, etc.:;FALSE;root;root, staging, vendor;kind/cleanup, sig/scheduling, area/apiserver, lgtm, area/cloudprovider, sig/node, sig/api-machinery, release-note, size/M, sig/auth;ci;Bump etcd 3.6.7 SDK
136398;2026-01-21T15:19:02Z;2026-01-22T20:39:28Z;29,34;9;109;8;1;Switch node perf tests from TensorFlow to PyTorch Wide-Deep;/kind featureReplace the TensorFlow-based wide-deep workload with the PyTorch implementation. This change:Adds pytorchWideDeepWorkload using the new pytorch-wide-deep imageRemoves tfWideDeepWorkload and tf-wide-deep image referencesEnables arm64 support (PyTorch image is multi-arch)Uses the same log parsing (time -p output format)xref: #136397 (for image)What type of PR is this?/kind featureWhat this PR does / why we need it:Which issue(s) this PR is related to:Special notes for your reviewer:Does this PR introduce a user-facing change?Using pytorch based e2e integration test instead of tensorflow in some node e2e CI tests.Additional documentation e.g., KEPs (Kubernetes Enhancement Proposals), usage docs, etc.:;FALSE;test;test;area/test, lgtm, sig/node, release-note, size/L, kind/feature, approved, cncf-cla: yes, sig/testing, needs-priority;test;Switch node perf tests from TensorFlow to PyTorch Wide-Deep  Replace the TensorFlow-based wide-deep workload with the PyTorch implementation. This change:  - Adds pytorchWideDeepWorkload using the new pytorch-wide-deep image (1.0.0) - Removes tfWideDeepWorkload and tf-wide-deep image references - Enables arm64 support (PyTorch image is multi-arch) - Uses the same log parsing (time -p output format)  Signed-off-by: Davanum Srinivas <davanum@gmail.com>
128653;2024-11-07T10:08:19Z;2025-07-04T14:21:25Z;5740,22;28;57459;41;28;Remove gogo from proto bindings (part 1: CRI);What type of PR is this?/kind cleanupWhat this PR does / why we need it:gogo protobuf is deprecated since years and we should find alternatives or work without it.Which issue(s) this PR fixes:Part of #96564Special notes for your reviewer:NoneDoes this PR introduce a user-facing change?Removed deprecated gogo protocol definitions from `k8s.io/cri-api` in favor of `google.golang.org/protobuf`.Additional documentation e.g., KEPs (Kubernetes Enhancement Proposals), usage docs, etc.:None;FALSE;hack;hack, pkg, staging, test;area/test, priority/important-soon, area/kubelet, kind/cleanup, area/apiserver, lgtm, sig/node, sig/api-machinery, release-note, size/XXL;other;Remove gogo-protobuf from CRI  Signed-off-by: Sascha Grunert <sgrunert@redhat.com>
135381;2025-11-21T03:45:53Z;2026-01-16T13:59:17Z;1354,22;1;192;5;2;[KEP-5440]: Add integration test for MutablePodResourcesForSuspendedJobs with Pod Replacement Policy = Failed;This test verifies that when a job with PodReplacementPolicy=Failed is suspended and pods are terminating, resource updates can be made to the job but new pods are only created after terminating pods are removed. The new pods should have the updated resources.What type of PR is this?What this PR does / why we need it:This test verifies that when a job with PodReplacementPolicy=Failed is suspended and pods are terminating, resource updates can be made to the job but new pods are only created after terminating pods are removed. The new pods should have the updated resources.https://github.com/kubernetes/enhancements/blob/master/keps/sig-apps/5440-mutable-job-pod-resource-updates/README.md#integration-testsWhich issue(s) this PR is related to:https://github.com/kubernetes/enhancements/blob/master/keps/sig-apps/5440-mutable-job-pod-resource-updates/README.md#integration-testsSpecial notes for your reviewer:Assisted with Claude Code.Does this PR introduce a user-facing change?NONEAdditional documentation e.g., KEPs (Kubernetes Enhancement Proposals), usage docs, etc.:;FALSE;test;test;area/test, priority/important-soon, lgtm, size/L, kind/feature, release-note-none, sig/apps, approved, cncf-cla: yes, sig/testing;bugfix;Add integration test for MutablePodResourcesForSuspendedJobs with PodReplacementPolicy=Failed  This test verifies that when a job with PodReplacementPolicy=Failed is suspended and pods are terminating, resource updates can be made to the job but new pods are only created after terminating pods are removed. The new pods should have the updated resources.
135751;2025-12-14T21:55:56Z;2026-01-22T18:27:37Z;932,53;1;6;12;1;Fix goroutine leak in pluginmanager test;What type of PR is this?/kind bugWhat this PR does / why we need it:Use a buffered channel for the operation start signal to prevent goroutines from blocking indefinitely. When the test receiver times out before all goroutines send their signal, an unbuffered channel causes those goroutines to block forever on the send operation.Which issue(s) this PR is related to:fixes: #134939Special notes for your reviewer:Does this PR introduce a user-facing change?NONEAdditional documentation e.g., KEPs (Kubernetes Enhancement Proposals), usage docs, etc.:none;FALSE;pkg;pkg;kind/bug, area/kubelet, lgtm, sig/node, size/XS, release-note-none, approved, cncf-cla: yes, ok-to-test, needs-priority;bugfix;Fix goroutine leak in pluginmanager test  Use a buffered channel for the operation start signal to prevent goroutines from blocking indefinitely. When the test receiver times out before all goroutines send their signal, an unbuffered channel causes those goroutines to block forever on the send operation. The buffer size is computed dynamically using max() to ensure it always accommodates the maximum number of concurrent operations any test may spawn.
132047;2025-05-31T18:09:15Z;2026-01-22T18:27:29Z;5664,30;2;10;40;2;kubelet/windows: use CommitMemoryBytes for MemoryStats.UsageBytes in CRI stats provider;What type of PR is this?/kind bug/sig windowsWhat this PR does / why we need it:Fix Windows CRI stats provider to correctly set MemoryStats.UsageBytes for containers and podsWhich issue(s) this PR fixes:Fixes #Special notes for your reviewer:Does this PR introduce a user-facing change?NONEAdditional documentation e.g., KEPs (Kubernetes Enhancement Proposals), usage docs, etc.:- [KEP]: https://github.com/kubernetes/enhancements/issues/2371;FALSE;pkg;pkg;kind/bug, area/test, area/kubelet, lgtm, sig/node, size/S, release-note-none, approved, sig/windows, cncf-cla: yes;other;kubelet/windows: use CommitMemoryBytes for MemoryStats.UsageBytes in CRI stats provider
136404;2026-01-21T19:04:57Z;2026-01-22T17:17:30Z;22,21;5;48;7;4;add nonewprivs to agnhost;What type of PR is this?/kind cleanupWhat this PR does / why we need it:This PR makes nonewprivs part of agnhost so we can remove the nonewprivs image./cc @dimsWhich issue(s) this PR is related to:Special notes for your reviewer:Does this PR introduce a user-facing change?NONEAdditional documentation e.g., KEPs (Kubernetes Enhancement Proposals), usage docs, etc.:;FALSE;test;test;area/test, kind/cleanup, lgtm, size/M, release-note-none, approved, cncf-cla: yes, sig/testing, needs-priority, needs-triage;feature;add nonewprivs to agnhost
136397;2026-01-21T15:05:25Z;2026-01-22T14:45:28Z;23,67;4;329;18;21;Add PyTorch Wide-Deep node performance test image;We tried a few things earlier :( but let's just switch over now to another framework.Add a new PyTorch-based Wide-Deep benchmark image to replace the TensorFlow version which has compatibility issues with tf.estimator removal in TensorFlow 2.16+.Context:https://testgrid.k8s.io/sig-testing-images#post-kubernetes-push-e2e-node-perf-npb-ep-test-images#136349What type of PR is this?/kind featureWhat this PR does / why we need it:Which issue(s) this PR is related to:Special notes for your reviewer:Does this PR introduce a user-facing change?Using pytorch based e2e integration test instead of tensorflow in some node e2e CI tests.Additional documentation e.g., KEPs (Kubernetes Enhancement Proposals), usage docs, etc.:;TRUE;test;test;area/test, lgtm, release-note, size/L, kind/feature, approved, cncf-cla: yes, sig/testing, needs-priority, needs-triage;feature;Add PyTorch Wide-Deep node performance test image  Add a new PyTorch-based Wide-Deep benchmark image to replace the TensorFlow version which has compatibility issues with tf.estimator removal in TensorFlow 2.16+.  Signed-off-by: Davanum Srinivas <davanum@gmail.com>
136425;2026-01-22T13:07:05Z;2026-01-22T16:25:39Z;3,31;1;1;4;1;Remove previously added print statement for test debug ;What type of PR is this?/kind cleanupWhat this PR does / why we need it:While working on PR #135611 I have added this  print statement for debug and failed to remove in the final version.Which issue(s) this PR is related to:Special notes for your reviewer:Does this PR introduce a user-facing change?NONEAdditional documentation e.g., KEPs (Kubernetes Enhancement Proposals), usage docs, etc.:;FALSE;pkg;pkg;kind/cleanup, sig/scheduling, lgtm, size/XS, release-note-none, sig/apps, approved, cncf-cla: yes, needs-priority, needs-triage;bugfix;Remove fmt.Println() added for debug
136359;2026-01-20T21:04:36Z;2026-01-22T16:25:32Z;43,35;6;46;13;3;test: update code to use GlibcDnsTesting image;Updates the codebase to use the new glibc-dns-testing image which replaces the deprecated jessie-dnsutils image.This PR depends on the glibc-dns-testing image being available in the registry (registry.k8s.io/e2e-test-images/glibc-dns-testing:2.0).xref: #136358 (has to land first!)xref: #136357What type of PR is this?/kind cleanupWhat this PR does / why we need it:Which issue(s) this PR is related to:Special notes for your reviewer:Does this PR introduce a user-facing change?NONEAdditional documentation e.g., KEPs (Kubernetes Enhancement Proposals), usage docs, etc.:;FALSE;test;test;area/test, sig/network, kind/cleanup, lgtm, sig/storage, sig/node, size/M, release-note-none, approved, cncf-cla: yes;test;test: update code to use GlibcDnsTesting image  Updates the codebase to use the new glibc-dns-testing image which replaces the deprecated jessie-dnsutils image.  This PR depends on the glibc-dns-testing image being available in the registry (registry.k8s.io/e2e-test-images/glibc-dns-testing:2.0.0).  Signed-off-by: Davanum Srinivas <davanum@gmail.com>
136419;2026-01-22T09:03:25Z;2026-01-22T13:47:28Z;4,73;1;6;5;0;Add github.com/google/btree to unwanted dependencies;"This PR adds github.com/google/btree to the unwanted dependencies list.ChangesAdded github.com/google/btree to unwantedModules with reason: ""unmaintained, archive mode""Added unwantedReferences tracking for github.com/google/btree:go.etcd.io/etcd/server/v3k8s.io/apiserverAdded github.com/google/btree to unwantedVendored listxref #136415/kind cleanupReasonThe github.com/google/btree module is unmaintained and in archive mode, making it unsuitable for continued use in Kubernetes.Verification✅ hack/lint-dependencies.sh passes successfully✅ JSON format is validNONE";FALSE;hack;hack;kind/cleanup, lgtm, sig/api-machinery, size/XS, release-note-none, approved, cncf-cla: yes, needs-priority, needs-triage;feature;Add github.com/google/btree to unwanted dependencies  Mark github.com/google/btree as unwanted due to being unmaintained and in archive mode. The module is currently referenced by: - go.etcd.io/etcd/server/v3 - k8s.io/apiserver
136414;2026-01-22T04:05:53Z;2026-01-22T12:41:37Z;8,60;2;10;7;2;Fix post-kubernetes-push-e2e-node-perf-npb-is-test-images problem (arm64);Trying to fix:https://storage.googleapis.com/kubernetes-ci-logs/logs/post-kubernetes-push-e2e-node-perf-npb-is-test-images/2014181091459469312/build-log.txtThe arm64 build of npb-is was failing with relocation overflow errors because the IS benchmark with CLASS=D produces large binaries that exceed the default code model limits.Add arm64-specific compiler flags to fix the relocation overflow:-mcmodel=large: use large code model for > 4GB address space-fno-PIE: disable position-independent executable (incompatible with large model)-mno-outline-atomics: inline atomics to avoid linker issuesWhat type of PR is this?/kind cleanupWhat this PR does / why we need it:Which issue(s) this PR is related to:Special notes for your reviewer:Does this PR introduce a user-facing change?NONEAdditional documentation e.g., KEPs (Kubernetes Enhancement Proposals), usage docs, etc.:;FALSE;test;test;area/test, kind/cleanup, lgtm, sig/node, size/S, release-note-none, approved, cncf-cla: yes, sig/testing, needs-priority;bugfix;Fix post-kubernetes-push-e2e-node-perf-npb-is-test-images problem (arm64)  Signed-off-by: Davanum Srinivas <davanum@gmail.com>
136389;2026-01-21T13:17:11Z;2026-01-22T12:41:28Z;23,40;3;7;6;0;Promote KEP-5311 (Relaxed validation for Services names) to beta;What type of PR is this?/kind featureWhat this PR does / why we need it:Promote Relaxed validation for Services names to BetaWhich issue(s) this PR is related to:KEP: kubernetes/enhancements#5311Special notes for your reviewer:Does this PR introduce a user-facing change?Promote Relaxed validation for Services names to beta (enabled by default)Promote `RelaxedServiceNameValidation` feature to beta (enabled by default)The names of new Services names are validation with `NameIsDNSLabel()`,relaxing the pre-existing validation.Additional documentation e.g., KEPs (Kubernetes Enhancement Proposals), usage docs, etc.:- [KEP]: https://github.com/kubernetes/enhancements/issues/5311;FALSE;pkg;pkg, test;sig/network, lgtm, release-note, size/XS, kind/feature, approved, cncf-cla: yes, needs-priority, needs-triage;other;Promote KEP-5311 (Relaxed validation for Services names) to beta
136420;2026-01-22T10:08:06Z;2026-01-22T11:01:33Z;0,89;1;16;5;1;E2E framework ssh: avoid log spam in runSSHCommand;"What type of PR is this?/kind cleanupWhat this PR does / why we need it:Emitting ""error dialing"" on each retry spams the test log output even when the tests succeed.Using Eventually also has other advantages (better failure message, support for Gingko progress reports when a test is stuck).Which issue(s) this PR is related to:Fixes: #136260Special notes for your reviewer:Does this PR introduce a user-facing change?NONE";FALSE;test;test;area/test, kind/cleanup, lgtm, size/S, release-note-none, approved, cncf-cla: yes, sig/testing, needs-priority, area/e2e-test-framework;other;"E2E framework ssh: avoid log spam in runSSHCommand  Emitting ""error dialing"" on each retry spams the test log output even when the tests succeed.  Using Eventually also has other advantages (better failure message, support for Gingko progress reports when a test is stuck)."
