pr_number;created_at;merged_at;time_to_merge_hours;changed_files;lines_changed;total_comments;total_reviews;pr_title;pr_body;has_changes_requested;main_module;cross_modules;labels_list;inferred_task_type;commit_messages
136052;2026-01-06T09:28:57Z;2026-01-24T05:03:48Z;427,58;1;26;9;0;Added missing tests for client-go metrics;What type of PR is this?/kind cleanupWhat this PR does / why we need it:This PR adds missing tests for some of the client-go metrics.In #134420, I had added a new metric, but it was discussed in the review that the new metric is redundant. While working on this issue, I realized that there were tests missing for some of the metrics and had brought it up in the SIG meeting.Which issue(s) this PR is related to:N/ASpecial notes for your reviewer:Does this PR introduce a user-facing change?Added missing tests for client-go metricsAdditional documentation e.g., KEPs (Kubernetes Enhancement Proposals), usage docs, etc.:N/A;FALSE;staging;staging;kind/cleanup, lgtm, release-note, size/S, approved, cncf-cla: yes, sig/instrumentation, sig/architecture, needs-priority, needs-triage;feature;Added missing tests for client-go metrics  Signed-off-by: sreeram-venkitesh <sreeramvenkitesh@gmail.com>
135761;2025-12-16T00:13:19Z;2026-01-24T05:03:31Z;940,84;19;485;14;10;feat: wire admissionregistration group for declarative validation and +k8s:required to ValidatingAdmissionPolicyBindingSpec.PolicyName;"/kind feature/sig api-machinery/sig authWhat this PR does / why we need itEnables the validation-gen framework for the admissionregistration.k8s.io API group (v1, v1beta1, v1alpha1).Adds Declarative Validation (DV) support for ValidatingAdmissionPolicyBinding, focusing on spec.policyName.Maintains parity with existing hand-written strategy validation as part of the incremental DV migration.Marks the corresponding legacy validation logic for spec.policyName as covered by DV to avoid duplicate/partial coverage confusion during the transition.Which issue(s) this PR is related toPart of #134280Part of #135752Special notes for your reviewerScope is limited to enabling validation-gen + DV coverage for ValidatingAdmissionPolicyBinding.spec.policyName; no user-visible behavior changes intended.Includes unit tests that verify parity between declarative and hand-written validations (create/update paths).Follow-ups can extend DV coverage to additional ValidatingAdmissionPolicyBinding fields and related admissionregistration types.Test planTable-driven unit tests covering:Create & update validation for v1, v1beta1, and v1alpha1Required field validation for spec.policyNameParity checks via VerifyValidationEquivalence and VerifyUpdateValidationEquivalenceDoes this PR introduce a user-facing change?NONE";FALSE;api;api, pkg, staging;lgtm, size/L, kind/api-change, release-note-none, approved, cncf-cla: yes, sig/architecture, area/code-generation, needs-priority, needs-triage;feature;feat(admissionregistration): wire group for declarative validation and require PolicyName
135694;2025-12-10T09:03:44Z;2026-01-24T03:31:26Z;1074,46;3;12;6;1;Update cri-tools to v1.35.0;What type of PR is this?/kind cleanupWhat this PR does / why we need it:Update cri-tools to the latest release.Which issue(s) this PR is related to:Part of  kubernetes-sigs/cri-tools#1953Special notes for your reviewer:Does this PR introduce a user-facing change?Updated cri-tools to v1.35.0.Additional documentation e.g., KEPs (Kubernetes Enhancement Proposals), usage docs, etc.:None;FALSE;build;build, cluster;kind/cleanup, lgtm, area/provider/gcp, sig/node, release-note, size/S, approved, cncf-cla: yes, sig/cloud-provider, needs-priority;other;Update cri-tools to v1.35.0  Signed-off-by: Sascha Grunert <sgrunert@redhat.com>
136325;2026-01-19T13:25:40Z;2026-01-21T00:07:25Z;34,70;2;24;15;2;fix(expansion):Resolve the issue of UTF-8 characters being truncated;What type of PR is this?/kind bugWhat this PR does / why we need it:The tryReadVariableName function uses string (input [0]) to only take the first byte, and multi byte UTF-8 characters are truncated, resulting in invalid UTF-8The $+non ASCII characters in the environment variable value will be corrupted, resulting in invalid UTF-8 that will be rejected by the strict validation of gRPC v1.72+, causing container creation failure: grpc: error while marshalling: string field contains invalid UTF-8Which issue(s) this PR is related to:Fixes:#136323 (comment)Fixes a 1.34 regression starting pods with environment variables with a value containing `$` followed by a multi-byte character;FALSE;third_party;third_party;kind/bug, lgtm, release-note, size/S, approved, cncf-cla: yes, sig/architecture, ok-to-test, needs-priority, kind/regression;bugfix;fix(expansion):Resolve the issue of UTF-8 characters being truncated, resulting in invalid UTF-8
136444;2026-01-23T01:30:15Z;2026-01-24T02:09:35Z;24,66;34;50;6;1;drop armv7 from our e2e test images;What type of PR is this?/kind cleanupWhat this PR does / why we need it:We dropped support for arm32 in #115742perl and nonewprivs are being deleted entirely in separate PRs.Also, the images I changed that didn't have semver versioning, now have it./cc @dimsWhich issue(s) this PR is related to:Special notes for your reviewer:Does this PR introduce a user-facing change?NONEAdditional documentation e.g., KEPs (Kubernetes Enhancement Proposals), usage docs, etc.:;FALSE;test;test;area/test, kind/cleanup, lgtm, size/M, release-note-none, approved, cncf-cla: yes, sig/testing, needs-priority, needs-triage;test;drop armv7 from our e2e test images
135291;2025-11-13T13:44:40Z;2026-01-24T02:09:28Z;1716,41;1;2;4;0;fix case title in kubelet/server unit;What type of PR is this?/kind bugWhat this PR does / why we need it:fix a minor issue that a title of unit case is wrong. :)Special notes for your reviewer:Does this PR introduce a user-facing change?NONEAdditional documentation e.g., KEPs (Kubernetes Enhancement Proposals), usage docs, etc.:NONE/triage accepted/priority backlog/sig node;FALSE;pkg;pkg;kind/bug, priority/backlog, area/kubelet, lgtm, sig/node, size/XS, release-note-none, approved, cncf-cla: yes, triage/accepted;bugfix;chore: fix case title in kubelet/server unit
136379;2026-01-21T09:07:59Z;2026-01-24T01:13:27Z;64,09;1;4;20;6;cleanup: improve darwin error messages;What type of PR is this?/kind cleanupWhat this PR does / why we need it:While reviewing the hack/ directory, I noticed stale TODOs regarding Kubelet and kube-proxy support on Darwin. Since native support is not planned and the community standard has shifted to tools like kind for macOS development, I have removed these TODOs and updated the error messages to provide more helpful guidance to users.Which issue(s) this PR is related to:Fixes #NONEN/ASpecial notes for your reviewer:This is my first contribution to the Kubernetes project. As a Senior DevOps Engineer, I wanted to start by cleaning up technical debt in the internal tooling scripts used for local development.Does this PR introduce a user-facing change?NONE;FALSE;hack;hack;kind/cleanup, lgtm, sig/cluster-lifecycle, size/XS, release-note-none, approved, cncf-cla: yes, ok-to-test, needs-priority, needs-triage;bugfix;cleanup: improve darwin error messages
136486;2026-01-23T23:20:16Z;2026-01-24T00:21:27Z;1,02;1;2;4;1;Add timeout to ImagePullTest poll loop to prevent infinite hangs;ImagePullTest was using wait.PollUntilContextCancel which has no timeout, causing tests to hang for hours when the expected container state is never reached (e.g., ErrImageNeverPull).Changed to wait.PollUntilContextTimeout with ContainerStatusRetryTimeout (5 minutes), matching the pattern used by other tests in the same file.What type of PR is this?/kind failing-testWhat this PR does / why we need it:Which issue(s) this PR is related to:Special notes for your reviewer:Does this PR introduce a user-facing change?NONEAdditional documentation e.g., KEPs (Kubernetes Enhancement Proposals), usage docs, etc.:;FALSE;test;test;area/test, lgtm, sig/node, size/XS, release-note-none, approved, cncf-cla: yes, sig/testing, kind/failing-test, needs-priority;feature;Add timeout to ImagePullTest poll loop to prevent infinite hangs  ImagePullTest was using wait.PollUntilContextCancel which has no timeout, causing tests to hang for hours when the expected container state is never reached (e.g., ErrImageNeverPull).  Changed to wait.PollUntilContextTimeout with ContainerStatusRetryTimeout (5 minutes), matching the pattern used by other tests in the same file.  Signed-off-by: Davanum Srinivas <davanum@gmail.com>
134345;2025-09-30T17:17:53Z;2025-11-11T15:18:57Z;1006,02;34;3447;31;64;Implement RestartAllContainers;What type of PR is this?/kind featureWhat this PR does / why we need it:Implement RestartAllContainers KEP: kubernetes/enhancements#5532Which issue(s) this PR is related to:KEP: kubernetes/enhancements#5532Special notes for your reviewer:Does this PR introduce a user-facing change?Allows restart all containers when the source container exits with a matching restart policy rule. This is an alpha feature behind feature gate RestartAllContainersOnContainerExit.Additional documentation e.g., KEPs (Kubernetes Enhancement Proposals), usage docs, etc.:- [KEP]: https://github.com/kubernetes/enhancements/issues/5532;FALSE;pkg;pkg, staging, test;area/test, priority/important-soon, area/kubelet, lgtm, sig/node, release-note, size/XXL, kind/api-change, sig/apps, approved;feature;Implement restartPod action | add disruptive tests | Refactor validation | Add dependency for NodeDeclaredFeatures | Keep pod in running state and prune past container status from runtime
136166;2026-01-12T05:14:57Z;2026-01-23T18:59:31Z;277,74;3;110;14;2;Add test and doc for processing all the sub-directories in kubelet drop-in folder;What type of PR is this?/kind bugWhat this PR does / why we need it:Identified while reviewing: #136089 (comment) by @bart0shThis PR documents and adds tests to make sure that kubelet drop-in configuration directory processes .conf files in the top-level and sub-directories directory.The PR discussed using top level directory alone but we decided to keep the existing functionalityWhich issue(s) this PR is related to:Special notes for your reviewer:Updated function documentation in cmd/kubelet/app/server.goUpdated field comment in cmd/kubelet/app/options/options.goUpdated --config-dir flag help text to document this behaviorDoes this PR introduce a user-facing change?NONE  - [Other doc]: https://kubernetes.io/docs/reference/command-line-tools-reference/kubelet/;FALSE;cmd;cmd;kind/bug, area/kubelet, lgtm, sig/node, size/L, release-note-none, approved, cncf-cla: yes, ok-to-test, needs-priority;feature;Add test and doc for processing all the sub-directories in drop-in folder
136413;2026-01-22T01:53:19Z;2026-01-23T18:05:37Z;40,20;23;151;10;15;  kubelet: migrate kubelet_getters.go to contextual logging;Migrate GetNode and related getter functions to contextual logging.GetNode(ctx context.Context)getNodeAnyWay(ctx context.Context)getLastObservedNodeAddresses(ctx context.Context)getHostIPsAnyWay(ctx context.Context)Update all callers and test mocks.Follows #136186.NONE/kind cleanup/cc @bart0sh;FALSE;pkg;pkg;area/kubelet, kind/cleanup, lgtm, sig/node, size/L, release-note-none, approved, cncf-cla: yes, ok-to-test, needs-priority;other;kubelet: migrate kubelet_getters.go to contextual logging. Migrate GetNode and related functions to use contextual logging
133335;2025-07-31T10:37:36Z;2026-01-23T18:05:29Z;4231,46;6;85;18;7;pluginmanager: fix handling registration failures;What type of PR is this?/kind bugWhat this PR does / why we need it:Updated the pluginmanager to handle registration failures better by removing the plugin from the actual state of the world and deregistering when registration or notification fails. Added a new e2e test to verify that the kubelet plugin manager retries plugin registration when NotifyRegistrationStatus call fails.Which issue(s) this PR is related to:N/ASpecial notes for your reviewer:Does this PR introduce a user-facing change?The kubelet plugin manager now properly handles plugin registration failures by removing failed plugins from the actual state and retrying with exponential backoff (initial delay 500ms, doubling each failure up to ~2 minutes maximum) to protect against broken plugins causing denial of service while still allowing recovery from transient failures./sig node;FALSE;pkg;pkg, staging, test;kind/bug, area/test, area/kubelet, lgtm, sig/storage, sig/node, release-note, size/M, approved, cncf-cla: yes;bugfix;pluginmanager: fix handling registration failures  Updated the pluginmanager to handle registration failures better by removing the plugin from the actual state of the world and deregistering when registration or notification fails. Added a new e2e test to verify that the kubelet plugin manager retries plugin registration when NotifyRegistrationStatus call fails.
136443;2026-01-22T23:02:08Z;2026-01-23T13:27:39Z;14,43;1;24;15;3;Bump e2e test images to latest promoted versions;Looks like overtime, we updated versions but did not end up updating the test harness to new versions!! 💀Image updates:ipc-utils: 1.3 → 1.4kitten: 1.7 → 1.8nautilus: 1.7 → 1.8nginx: 1.14-4 → 1.15-4nginx (new): 1.15-4 → 1.27-0node-perf/npb-ep: 1.2 → 1.6.0node-perf/npb-is: 1.2 → 1.7.0nonewprivs: 1.3 → 1.4nonroot: 1.4 → 1.5resource-consumer: 1.13 → 1.14volume/nfs: 1.4 → 1.5volume/iscsi: 2.6 → 2.7What type of PR is this?/kind cleanupWhat this PR does / why we need it:Which issue(s) this PR is related to:Special notes for your reviewer:Does this PR introduce a user-facing change?NONEAdditional documentation e.g., KEPs (Kubernetes Enhancement Proposals), usage docs, etc.:;FALSE;test;test;area/test, kind/cleanup, lgtm, size/S, release-note-none, approved, cncf-cla: yes, sig/testing, needs-priority, needs-triage;test;Bump e2e test images to latest promoted versions  Image updates: - ipc-utils: 1.3 → 1.4 - kitten: 1.7 → 1.8 - nautilus: 1.7 → 1.8 - nginx: 1.14-4 → 1.15-4 - nginx (new): 1.15-4 → 1.27-0 - node-perf/npb-ep: 1.2 → 1.6.0 - node-perf/npb-is: 1.2 → 1.7.0 - nonewprivs: 1.3 → 1.4 - nonroot: 1.4 → 1.5 - resource-consumer: 1.13 → 1.14 - volume/nfs: 1.4 → 1.6.0 - volume/iscsi: 2.6 → 2.7  Signed-off-by: Davanum Srinivas <davanum@gmail.com>
136089;2026-01-08T03:47:28Z;2026-01-23T13:27:31Z;369,67;3;144;7;25;Improve logging, doc and test for kubelet config-dir file extension;What type of PR is this?/kind cleanupWhat this PR does / why we need it:ProblemWhile using kubelet drop-in configuration files, we overlooked a critical requirement documented in the kubelet configuration guide:The suffix of a valid kubelet drop-in configuration file must be .conf. For instance: 99-kubelet-address.confWe created a drop-in file with a .yaml extension, and the configuration was silently ignored. Even with increased kubelet log verbosity, there was no indication that the file was being skipped, making this issue difficult to debug.ChangesThis PR improves the user experience when working with kubelet drop-in configurations:1. Enhanced LoggingAdded log statements at V(4) level to show which files are being skipped due to incorrect extensionsLogs include the filename and extension for better debuggingNo impact on default logging (only visible with increased verbosity)2. Improved DocumentationUpdated the --config-dir flag documentation to explicitly mention the .conf extension requirementAdded example: 99-kubelet-address.confClarified that only files with .conf extension will be loadedThis will update https://kubernetes.io/docs/reference/command-line-tools-reference/kubelet/3. Test CoverageAdded test case validating that .yaml files are ignoredAdded test case validating that malformed YAML in .conf files causes proper errorsTestingAll existing tests pass. New test cases verify:Files without .conf extension are ignored (addresses the reported issue)Invalid YAML syntax in .conf files fails with clear error messagesExisting merge behavior remains unchangedReferencesDocumentation: https://kubernetes.io/docs/tasks/administer-cluster/kubelet-config-file/Feature announcement: https://kubernetes.io/blog/2025/12/22/kubernetes-v1-35-kubelet-config-drop-in-directory-ga/Which issue(s) this PR is related to:Special notes for your reviewer:@haircommander We experienced this while testing memorySwap changes.cc: @BhargaviGudiDoes this PR introduce a user-facing change?NONEAdditional documentation e.g., KEPs (Kubernetes Enhancement Proposals), usage docs, etc.:;FALSE;cmd;cmd;priority/backlog, area/kubelet, kind/cleanup, lgtm, sig/node, size/L, release-note-none, approved, cncf-cla: yes, ok-to-test;refactor;Improve logging, doc and test for kubelet config-dir file extension
136344;2026-01-20T12:56:24Z;2026-01-23T12:07:29Z;71,18;6;186;10;6;Rename PodGroupInfo in preparation for Workload-aware scheduling changes;What type of PR is this?/kind cleanupWhat this PR does / why we need it:As mentioned in https://github.com/kubernetes/enhancements/pull/5733/changes#r2610449539, we want to have a more focused PodGroupInfo type than the current implementation.In this PR I rename PodGroupInfo to PodGroupState.PodGroupState is used to track live pod state, which is currently used by the GangScheduling plugin.The new PodGroupInfo type will describe a snapshotted state of a podgroup that will be used in the workload scheduling cycle plugins.Which issue(s) this PR is related to:KEP: kubernetes/enhancements#5732KEP: kubernetes/enhancements#4671Special notes for your reviewer:Does this PR introduce a user-facing change?Renamed PodGroupInfo to PodGroupState, which can break custom scheduler plugins that use Handle.WorkloadManagerAdditional documentation e.g., KEPs (Kubernetes Enhancement Proposals), usage docs, etc.:- [KEP]: https://github.com/kubernetes/enhancements/pull/5733/changes#diff-7ae886ce193e1c72e6a0673ded84f5552891a2b813918acd8cd5e5a3b6748c06R285;FALSE;pkg;pkg, staging;kind/cleanup, sig/scheduling, lgtm, release-note, size/L, approved, cncf-cla: yes, needs-priority, needs-triage;other;Rename PodGroupInfo to PodGroupState  This is in preparation for PodGroupInfo struct with more pod group details
132895;2025-07-11T18:21:06Z;2025-07-29T21:58:26Z;435,62;2;93;16;15;Fixes scheduler nil panic due to empty init container request&limit;"What type of PR is this?/kind bugWhat this PR does / why we need it:This PR fixes a nil panic issue in kube-scheduler which caused leader loss in a cluster:E0701 15:53:40.193220      11 runtime_faststr_swiss.go:265] ""Observed a panic"" panic=""assignment to entry in nil map"" panicGoValue=""\""assignment to entry in nil map\"""" stacktrace=<	goroutine 367 [running]:	k8s.io/apimachinery/pkg/util/runtime.logPanic({0x2e55568, 0xc000d5a2a0}, {0x25b3900, 0x463a5c0})		k8s.io/apimachinery/pkg/util/runtime/runtime.go:132 +0xbc	k8s.io/apimachinery/pkg/util/runtime.handleCrash({0x2e55568, 0xc000d5a270}, {0x25b3900, 0x463a5c0}, {0x0, 0x0, 0xc0009b0880?})		k8s.io/apimachinery/pkg/util/runtime/runtime.go:107 +0x116	k8s.io/apimachinery/pkg/util/runtime.HandleCrashWithLogger({{0x2e5df30?, 0xc00051eac0?}, 0xc0009b08c8?}, {0x0, 0x0, 0x0})		k8s.io/apimachinery/pkg/util/runtime/runtime.go:91 +0x115	panic({0x25b3900?, 0x463a5c0?})		runtime/panic.go:792 +0x132	k8s.io/component-helpers/resource.maxResourceList(0x0, 0x1f400000?)		k8s.io/component-helpers/resource/helpers.go:399 +0x2ba	k8s.io/component-helpers/resource.max(0xc0009b12b8?, {0xc000748c88, 0x2, 0x1f400000?})		k8s.io/component-helpers/resource/helpers.go:409 +0x5e	k8s.io/component-helpers/resource.determineContainerReqs(0xc000d5a210?, 0xc0009b1378?, 0xc000ae9bb0?)		k8s.io/component-helpers/resource/helpers.go:231 +0x175	k8s.io/component-helpers/resource.AggregateContainerRequests(0xc000b7b688, {0x0, 0x1, 0x0, 0x0, 0x0, 0x1})		k8s.io/component-helpers/resource/helpers.go:163 +0x265	k8s.io/component-helpers/resource.PodRequests(0xc000b7b688, {0x0, 0x1, 0x0, 0x0, 0x0, 0x1})		k8s.io/component-helpers/resource/helpers.go:123 +0x76	k8s.io/kubernetes/pkg/scheduler/framework.(*PodInfo).calculateResource(0xc0002fbf10)		k8s.io/kubernetes/pkg/scheduler/framework/types.go:1135 +0xfe	k8s.io/kubernetes/pkg/scheduler/framework.(*NodeInfo).update(0xc000b3b710, 0xc0002fbf10, 0x1)		k8s.io/kubernetes/pkg/scheduler/framework/types.go:1058 +0x3d	k8s.io/kubernetes/pkg/scheduler/framework.(*NodeInfo).AddPodInfo(0xc000b3b710, 0xc0002fbf10)		k8s.io/kubernetes/pkg/scheduler/framework/types.go:989 +0x206	k8s.io/kubernetes/pkg/scheduler/framework.(*NodeInfo).AddPod(0xc000b3b710, 0xc000b7b688)		k8s.io/kubernetes/pkg/scheduler/framework/types.go:997 +0x45	k8s.io/kubernetes/pkg/scheduler/backend/cache.(*cacheImpl).addPod(0xc0008484e0, {{0x2e5df30?, 0xc00051eac0?}, 0x25463c0?}, 0xc000b7b688, 0x0)Which issue(s) this PR is related to:Special notes for your reviewer:Does this PR introduce a user-facing change?Fixes a 1.33 regression that can cause a nil panic in kube-scheduler when aggregating resource requests across container's spec and status.";FALSE;staging;staging;kind/bug, priority/important-soon, sig/scheduling, lgtm, sig/node, release-note, size/M, kind/api-change, approved, cncf-cla: yes;bugfix;fixes scheduler nil panic due to empty init container request&limit  Signed-off-by: Min Jin <minkimzz@amazon.com>
136028;2026-01-05T13:22:39Z;2026-01-21T23:39:25Z;394,28;13;44;35;4;fix(kubelet): convert V().Error() to V().Info() for verbosity-aware logging;"What type of PR is this?/kind bugWhat this PR does / why we need it:This PR fixes incorrect usage of logger.V(N).Error() across the kubelet package. The go-logr package design causes Error() calls to bypass verbosity level checks entirely, meaning these logs are always printed regardless of the configured verbosity level.This causes production log flooding and defeats the purpose of using verbosity levels.Which issue(s) this PR fixes:Fixes #136027Special notes for your reviewer:The linter check from kubernetes-sigs/logtools#32 identified 21 instances across the kubelet package. This PR addresses all of them.Files modified (15 files, 21 instances):pkg/kubelet/allocation/allocation_manager.gopkg/kubelet/cm/devicemanager/plugin/v1beta1/client.gopkg/kubelet/cm/dra/plugin/dra_plugin_manager.gopkg/kubelet/images/pullmanager/metrics.gopkg/kubelet/kubelet.gopkg/kubelet/kuberuntime/kuberuntime_container_linux.gopkg/kubelet/lifecycle/handlers.gopkg/kubelet/metrics/collectors/cri_metrics.gopkg/kubelet/pleg/generic.gopkg/kubelet/prober/prober.gopkg/kubelet/prober/prober_manager.gopkg/kubelet/stats/cri_stats_provider.gopkg/kubelet/stats/helper.gopkg/kubelet/volumemanager/cache/desired_state_of_world.gopkg/kubelet/volumemanager/reconciler/reconstruct.goConversion patterns applied:V(N).Error(nil, ""msg"", ...) → V(N).Info(""msg"", ...)V(N).Error(err, ""msg"", ...) → V(N).Info(""msg"", ..., ""err"", err)Does this PR introduce a user-facing change?Fixed kubelet logging to properly respect verbosity levels. Previously, some debug/info messages using V().Error() would always be printed regardless of the configured log verbosity.Additional documentation e.g., KEPs (Alarm Proposal Docs), usage docs, etc.:N/A/sig node/area kubelet";FALSE;pkg;pkg;kind/bug, area/kubelet, lgtm, sig/node, release-note, size/M, approved, cncf-cla: yes, ok-to-test, needs-priority;bugfix;"fix(kubelet): convert V().Error() to V().Info() for verbosity-aware logging  The go-logr package ignores verbosity level (V()) for Error() calls, causing these logs to always print regardless of the -v flag setting. Convert to Info() with ""err"" key-value pair to respect verbosity levels.  This change covers 23 instances across kubelet components: - prober (4 instances) - lifecycle (4 instances) - stats (3 instances) - kuberuntime (2 instances) - pleg (1 instance) - allocation (1 instance) - cm/devicemanager (1 instance) - cm/dra (1 instance) - metrics/collectors (1 instance) - kubelet.go (3 instances) - images/pullmanager (2 instances)  Ref: https://github.com/kubernetes/kubernetes/issues/136027 Signed-off-by: thc1006 <84045975+thc1006@users.noreply.github.com> | fix(kubelet): convert V().Error() to V().Info() in volumemanager  Apply the same verbosity-aware logging fix to volumemanager components: - desired_state_of_world.go (2 instances) - reconciler/reconstruct.go (1 instance)  This completes the kubelet-wide fix for V().Error() ignoring verbosity.  Signed-off-by: thc1006 <84045975+thc1006@users.noreply.github.com>"
136303;2026-01-18T19:30:53Z;2026-01-22T23:47:27Z;100,28;1;32;10;2;scheduler: deflake TestUnReservePreBindPlugins;What type of PR is this?/kind flakeWhat this PR does / why we need it:After #135393, the scheduler may retry after a PreBind rejection, causing PreBind and Unreserve to be invoked more than once.This PR introduces a PreEnqueue gate which blocks the pod from being re-enqueued after a PreBind attempt has been made, ensuring that PreBind and Unreserve are called exactly once per test case.Context: #136261 (comment)Which issue(s) this PR is related to:Ref #136261Special notes for your reviewer:Does this PR introduce a user-facing change?NONEAdditional documentation e.g., KEPs (Kubernetes Enhancement Proposals), usage docs, etc.:;FALSE;test;test;area/test, sig/scheduling, lgtm, size/M, kind/flake, release-note-none, approved, cncf-cla: yes, sig/testing, ok-to-test;test;scheduler: deflake TestUnReservePreBindPlugins
